Article,Downloads
Building a Successful Startup Team,5
Orphan Drugs: Understanding the FDA Approval Process,4
Accelerators and Incubators,3
"FDA Device Regulation: 510(k), PMA",1
FDA Drug Regulation: Investigational New Drug Applications,1
Reimbursement Strategies and CPT Codes for Device Development,1
Human-Centered Design: Understanding Customers’ Needs Through Discovery and Interviewing,1
Innate Biases,1
Startup Company Formation and Management,1
Digital Health: Software as a Medical Device,1